company,job_title,job_link,location
Google,"Software Engineering Intern, PhD, Summer 2026",https://www.google.com/about/careers/applications/jobs/results/118106937735684806-software-engineering-intern-phd-summer-2026?distance=50&q=internship&page=1,"Mountain View, CA, USA"
Google,"Business Intern, 2026 (English)",https://www.google.com/about/careers/applications/jobs/results/89075959788905158-business-intern-2026-english?distance=50&q=internship&page=1,"Shanghai, China"
Google,"Software Developer Intern, PhD, Summer 2026",https://www.google.com/about/careers/applications/jobs/results/122888894193509062-software-developer-intern-phd-summer-2026?distance=50&q=internship&page=1,"Waterloo, ON, Canada"
Google,"Research Intern, PhD, Summer 2026",https://www.google.com/about/careers/applications/jobs/results/100216277234000582-research-intern-phd-summer-2026?distance=50&q=internship&page=1,"Mountain View, CA, USA"
Google,"MBA Intern, 2026",https://www.google.com/about/careers/applications/jobs/results/111504347728093894-mba-intern-2026?distance=50&q=internship&page=1,"Shanghai, China"
Google,"Research Scientist Intern, PhD, 2026",https://www.google.com/about/careers/applications/jobs/results/138943780848837318-research-scientist-intern-phd-2026?distance=50&q=internship&page=1,"Bengaluru, Karnataka, India"
Google,"Research Intern, PhD, Summer 2026",https://www.google.com/about/careers/applications/jobs/results/137871939145212614-research-intern-phd-summer-2026?distance=50&q=internship&page=1,"Waterloo, ON, Canada"
Google,"Silicon Engineering Intern, 2026",https://www.google.com/about/careers/applications/jobs/results/106735309995025094-silicon-engineering-intern-2026?distance=50&q=internship&page=1,"New Taipei, Banqiao District, New Taipei City, Taiwan"
Google,"Software Engineering Intern, PhD, Summer 2026",https://www.google.com/about/careers/applications/jobs/results/102119429319336646-software-engineering-intern-phd-summer-2026?distance=50&q=internship&page=1,"Taipei, Taiwan"
Google,"Data Center Technician Intern, 2026",https://www.google.com/about/careers/applications/jobs/results/82406896169820870-data-center-technician-intern-2026?distance=50&q=internship&page=1,"Inzai, Chiba, Japan"
Google,"User Experience Design Summer Intern, 2026",https://www.google.com/about/careers/applications/jobs/results/108001973965333190-user-experience-design-summer-intern-2026?distance=50&q=internship&page=1,Singapore
Google,"Hardware Engineering Intern, PhD, Summer 2026",https://www.google.com/about/careers/applications/jobs/results/133210998222791366-hardware-engineering-intern-phd-summer-2026?distance=50&q=internship&page=1,"Taipei, Taiwan"
Google,"Software Engineering PhD Intern, Summer 2026",https://www.google.com/about/careers/applications/jobs/results/129234040505934534-software-engineering-phd-intern-summer-2026?distance=50&q=internship&page=1,"Bengaluru, Karnataka, India"
Google,"Silicon Engineering Intern, PhD, Summer 2026",https://www.google.com/about/careers/applications/jobs/results/126191485673448134-silicon-engineering-intern-phd-summer-2026?distance=50&q=internship&page=1,"Bengaluru, Karnataka, India"
Google,"Student Researcher, PhD, Winter/Summer 2026",https://www.google.com/about/careers/applications/jobs/results/138166347879064262-student-researcher-phd-wintersummer-2026?distance=50&q=internship&page=1,"Mountain View, CA, USA"
Google,"Student Researcher, BS/MS, Winter/Summer 2026",https://www.google.com/about/careers/applications/jobs/results/140245524367188678-student-researcher-bsms-wintersummer-2026?distance=50&q=internship&page=1,"Mountain View, CA, USA"
Google,"Student Researcher, BS/MS, Winter/Summer 2026",https://www.google.com/about/careers/applications/jobs/results/123358125276177094-student-researcher-bsms-wintersummer-2026?distance=50&q=internship&page=1,"Waterloo, ON, Canada"
Google,"Student Researcher, PhD, Winter/Summer 2026",https://www.google.com/about/careers/applications/jobs/results/97480706799608518-student-researcher-phd-wintersummer-2026?distance=50&q=internship&page=1,"Waterloo, ON, Canada"
Google,"Student Researcher, 2026",https://www.google.com/about/careers/applications/jobs/results/74739844286161606-student-researcher-2026?distance=50&q=internship&page=1,"Tel Aviv, Israel"
Google,"Student Researcher, 2026",https://www.google.com/about/careers/applications/jobs/results/93865849051325126-student-researcher-2026?distance=50&q=internship&page=1,"Zürich, Switzerland"
Google,"Student Researcher, 2026",https://www.google.com/about/careers/applications/jobs/results/100753339674698438-student-researcher-2026?distance=50&q=internship&page=2,"Bengaluru, Karnataka, India"
Google,"Associate Field Sales Representative, Google Cloud, gReach Program for People with Disabilities (장애인 채용) (English, Korean)",https://www.google.com/about/careers/applications/jobs/results/106922261331485382-associate-field-sales-representative-google-cloud-greach-program-for-people-with-disabilities-english-korean?distance=50&q=internship&page=2,"Seoul, South Korea"
Google,"Associate Partner Development, Google Cloud, gReach Program for People with Disabilities (장애인 채용) (English, Korean)",https://www.google.com/about/careers/applications/jobs/results/137438570905248454-associate-partner-development-google-cloud-greach-program-for-people-with-disabilities-english-korean?distance=50&q=internship&page=2,"Seoul, South Korea"
Google,"Sales Administration Support Specialist, gReach Program for People with Disabilities (Japanese)",https://www.google.com/about/careers/applications/jobs/results/132564853008016070-sales-administration-support-specialist-greach-program-for-people-with-disabilities-japanese?distance=50&q=internship&page=2,"Tokyo, Japan"
Google,"Software Engineering Associate, gReach Program for People with Disabilities 障がい者雇用 (Japanese)",https://www.google.com/about/careers/applications/jobs/results/98700202633765574-software-engineering-associate-greach-program-for-people-with-disabilities-japanese?distance=50&q=internship&page=2,"Tokyo, Japan"
Google,"Marketing Manager Associate, gReach Program, People with Disabilities (Japanese, English)",https://www.google.com/about/careers/applications/jobs/results/133149201159594694-marketing-manager-associate-greach-program-people-with-disabilities-japanese-english?distance=50&q=internship&page=2,"Tokyo, Japan"
Google,"Technical Acceleration Program Manager, gReach Program for People with Disabilities (Japanese)",https://www.google.com/about/careers/applications/jobs/results/76561837729948358-technical-acceleration-program-manager-greach-program-for-people-with-disabilities-japanese?distance=50&q=internship&page=2,"Tokyo, Japan"
Google,"Solutions Consultant, gReach Program for People with Disabilities (Japanese)",https://www.google.com/about/careers/applications/jobs/results/135163136423404230-solutions-consultant-greach-program-for-people-with-disabilities-japanese?distance=50&q=internship&page=2,"Tokyo, Japan"
Google,"Physical Design Engineer, University Graduate, PhD",https://www.google.com/about/careers/applications/jobs/results/100868314875470534-physical-design-engineer-university-graduate-phd?distance=50&q=internship&page=2,"Sunnyvale, CA, USA"
Google,"RTL Design Engineer, University Graduate, PhD, Machine Learning",https://www.google.com/about/careers/applications/jobs/results/105829554005648070-rtl-design-engineer-university-graduate-phd-machine-learning?distance=50&q=internship&page=2,"Sunnyvale, CA, USA"
Google,"ASIC System Level Test Engineer, PhD, University Graduate",https://www.google.com/about/careers/applications/jobs/results/131937878245548742-asic-system-level-test-engineer-phd-university-graduate?distance=50&q=internship&page=2,"Sunnyvale, CA, USA"
Google,"Physical Design Engineer, 3D Technology, PhD, University Graduate",https://www.google.com/about/careers/applications/jobs/results/106741356235236038-physical-design-engineer-3d-technology-phd-university-graduate?distance=50&q=internship&page=2,"Sunnyvale, CA, USA"
Google,"Hardware Architecture Modeling Engineer, PhD, University Graduate",https://www.google.com/about/careers/applications/jobs/results/74084359799218886-hardware-architecture-modeling-engineer-phd-university-graduate?distance=50&q=internship&page=2,"Sunnyvale, CA, USA"
Google,"Account Manager Associate, Large Customer Sales (English)",https://www.google.com/about/careers/applications/jobs/results/74102866544861894-account-manager-associate-large-customer-sales-english?distance=50&q=internship&page=2,"Chicago, IL, USA"
Google,"Product Design Engineer, PhD, University Graduate, Platforms Infrastructure",https://www.google.com/about/careers/applications/jobs/results/132356312481571526-product-design-engineer-phd-university-graduate-platforms-infrastructure?distance=50&q=internship&page=2,"Sunnyvale, CA, USA"
Google,"Associate Product Marketing Manager (Turkish, English)",https://www.google.com/about/careers/applications/jobs/results/103667286811779782-associate-product-marketing-manager-turkish-english?distance=50&q=internship&page=2,"Istanbul, İstanbul, Türkiye"
Google,"Signal Integrity Engineer, University Graduate, PhD, Platforms Infrastructure",https://www.google.com/about/careers/applications/jobs/results/129545024458105542-signal-integrity-engineer-university-graduate-phd-platforms-infrastructure?distance=50&q=internship&page=2,"Sunnyvale, CA, USA"
Google,"Hardware Systems Quality and Reliability Engineering, University Graduate, PHD, Platforms Engineering",https://www.google.com/about/careers/applications/jobs/results/142691046130623174-hardware-systems-quality-and-reliability-engineering-university-graduate-phd-platforms-engineering?distance=50&q=internship&page=2,"Sunnyvale, CA, USA"
Google,"Network Operations Residency Program, University Graduate, 2026 Start",https://www.google.com/about/careers/applications/jobs/results/110139330885755590-network-operations-residency-program-university-graduate-2026-start?distance=50&q=internship&page=2,"Thornton, CO, USA"
Google,"Silicon Engineer, University Graduate, 2026",https://www.google.com/about/careers/applications/jobs/results/138178358352454342-silicon-engineer-university-graduate-2026?distance=50&q=internship&page=2,"Bengaluru, Karnataka, India"
Google,"Post-Doctoral Researcher, PhD, 2026 Start (Fixed-Term Contract)",https://www.google.com/about/careers/applications/jobs/results/122538034422784710-postdoctoral-researcher-phd-2026-start-fixedterm-contract?distance=50&q=internship&page=3,"Bengaluru, Karnataka, India"
Google,"Hardware Validation Engineer, University Graduate, Platforms Infrastructure",https://www.google.com/about/careers/applications/jobs/results/128978741610062534-hardware-validation-engineer-university-graduate-platforms-infrastructure?distance=50&q=internship&page=3,"Sunnyvale, CA, USA"
Google,"Lead, PhD Outreach and Recruiting",https://www.google.com/about/careers/applications/jobs/results/102012735755035334-lead-phd-outreach-and-recruiting?distance=50&q=internship&page=3,"New York, NY, USA"
Google,"Analytical Lead Associate, Sales Associate Program (English)",https://www.google.com/about/careers/applications/jobs/results/101007916076540614-analytical-lead-associate-sales-associate-program-english?distance=50&q=internship&page=3,"Chicago, IL, USA"
Google,"Customer Growth Associate, Google Customer Solutions (English)",https://www.google.com/about/careers/applications/jobs/results/78641653497111238-customer-growth-associate-google-customer-solutions-english?distance=50&q=internship&page=3,"San Francisco, CA, USA"
Google,"Software Engineer, University Graduate",https://www.google.com/about/careers/applications/jobs/results/141837376014951110-software-engineer-university-graduate?distance=50&q=internship&page=3,Singapore
Google,"Site Reliability Engineer, Software Engineering",https://www.google.com/about/careers/applications/jobs/results/100696105745818310-site-reliability-engineer-software-engineering?distance=50&q=internship&page=3,"Dublin, Ireland"
Google,"Software Engineer II, Google Cloud, Compute",https://www.google.com/about/careers/applications/jobs/results/141946263636452038-software-engineer-ii-google-cloud-compute?distance=50&q=internship&page=3,"Taipei, Taiwan"
Google,"ASIC RTL Design and Automation Engineer, University Graduate",https://www.google.com/about/careers/applications/jobs/results/103596918067602118-asic-rtl-design-and-automation-engineer-university-graduate?distance=50&q=internship&page=3,"Sunnyvale, CA, USA"
Google,"Technical Solutions Engineer Associate, Data",https://www.google.com/about/careers/applications/jobs/results/92700006217065158-technical-solutions-engineer-associate-data?distance=50&q=internship&page=3,"Mexico City, CDMX, Mexico"
Google,"Software Engineer I, Health Site Reliability Engineering",https://www.google.com/about/careers/applications/jobs/results/138884030069121734-software-engineer-i-health-site-reliability-engineering?distance=50&q=internship&page=3,"Sydney NSW, Australia"
Google,"Power Engineer, Platforms Engineering, PhD, University Graduate",https://www.google.com/about/careers/applications/jobs/results/101127290397565638-power-engineer-platforms-engineering-phd-university-graduate?distance=50&q=internship&page=3,"Sunnyvale, CA, USA"
Google,"Hardware Test Engineer, University Graduate, Platforms Infrastructure",https://www.google.com/about/careers/applications/jobs/results/123320124345066182-hardware-test-engineer-university-graduate-platforms-infrastructure?distance=50&q=internship&page=3,"Sunnyvale, CA, USA"
Google,"Software Engineer II, Site Reliability Engineering",https://www.google.com/about/careers/applications/jobs/results/92408843136312006-software-engineer-ii-site-reliability-engineering?distance=50&q=internship&page=3,"Warsaw, Poland"
Google,"Customer Solutions Engineer, Security, Google Cloud",https://www.google.com/about/careers/applications/jobs/results/76553756614763206-customer-solutions-engineer-security-google-cloud?distance=50&q=internship&page=3,"Warsaw, Poland"
Google,"Cloud Technical Solutions Engineer, Compute",https://www.google.com/about/careers/applications/jobs/results/131211948510323398-cloud-technical-solutions-engineer-compute?distance=50&q=internship&page=3,"Warsaw, Poland"
Google,"Software Engineer, GCE Control Plane, Early Careers, PhD",https://www.google.com/about/careers/applications/jobs/results/119716248828158662-software-engineer-gce-control-plane-early-careers-phd?distance=50&q=internship&page=3,"Warsaw, Poland"
Google,"Software Engineer, Early Careers, PhD, Cloud AI",https://www.google.com/about/careers/applications/jobs/results/116758841923642054-software-engineer-early-careers-phd-cloud-ai?distance=50&q=internship&page=3,"Warsaw, Poland"
Google,"Software Engineer, Performance, Reliability, Observability, PhD, Early Career",https://www.google.com/about/careers/applications/jobs/results/91485220485636806-software-engineer-performance-reliability-observability-phd-early-career?distance=50&q=internship&page=3,"Warsaw, Poland"
Google,"Resource Management Lead, Google Cloud Business Platform",https://www.google.com/about/careers/applications/jobs/results/100182360279917254-resource-management-lead-google-cloud-business-platform?distance=50&q=internship&page=3,"Sunnyvale, CA, USA"
Google,"Technical Solutions Developer I, Infrastructure, Compute, Google Cloud",https://www.google.com/about/careers/applications/jobs/results/119192713118524102-technical-solutions-developer-i-infrastructure-compute-google-cloud?distance=50&q=internship&page=4,"Waterloo, ON, Canada"
